<?xml version="1.0" encoding="UTF-8"?>

<!--
/*********************************************************************
* Copyright (c) 2021 Kentyou and others
*
* This program and the accompanying materials are made
* available under the terms of the Eclipse Public License 2.0
* which is available at https://www.eclipse.org/legal/epl-2.0/
*
* SPDX-License-Identifier: EPL-2.0
**********************************************************************/
-->

<sensinact:frames
	delimiter="4" 
	start="-1" 
	escape="35"
	xmlns:sensinact="http://org.eclipse.sensinact/frame"
	xmlns:xsi="http://www.w3.org/2001/XMLSchema-instance" 
	xsi:schemaLocation="http://org.eclipse.sensinact/frame ../../main/resources/frame.xsd ">
  <sensinact:types>
  	<sensinact:type>
  		<sensinact:name>parent</sensinact:name>
  		<sensinact:implementation>org.eclipse.sensinact.gateway.common.automata.test.TFrame</sensinact:implementation>
  	</sensinact:type>
  	<sensinact:type>
  		<sensinact:name>parent_bis</sensinact:name>
  		<sensinact:implementation>org.eclipse.sensinact.gateway.common.automata.test.TFrame_1</sensinact:implementation>
  	</sensinact:type>
  	<sensinact:type>
  		<sensinact:name>date</sensinact:name>
  		<sensinact:implementation>org.eclipse.sensinact.gateway.common.automata.test.UnixEpoch</sensinact:implementation>
  		<sensinact:length>4</sensinact:length>
  	</sensinact:type>
  	<sensinact:type>
  		<sensinact:name>size</sensinact:name>
  		<sensinact:implementation>org.eclipse.sensinact.gateway.common.automata.test.OneByteSizeFrame</sensinact:implementation>
  		<sensinact:length>1</sensinact:length>
  	</sensinact:type>
  	<sensinact:type>
  		<sensinact:name>data</sensinact:name>
  		<sensinact:implementation>org.eclipse.sensinact.gateway.common.automata.test.ASCIIDataFrame</sensinact:implementation>
  	</sensinact:type>
  </sensinact:types>
  <sensinact:frame name="parent" offset="0">
	<sensinact:frame name="size" offset="0"/>
	<sensinact:frame name="date" offset="1"/>
	<sensinact:frame name="parent_bis" offset="5">
		<sensinact:frame name="date" offset="0"/>
		<sensinact:frame name="data" offset="4"/>
	</sensinact:frame>
  </sensinact:frame>
</sensinact:frames>
